{"spec_version": "1.0", "app": {"name": "BookWell", "tagline": "Salon bookings without the phone tag", "domain": "appointment_booking", "locale": "en", "currency": "USD", "timezone": "UTC"}, "personas": [{"id": "owner", "name": "Salon owner", "goals": ["fill every chair", "cut no-shows"]}, {"id": "receptionist", "name": "Receptionist", "goals": ["book fast", "see the day at a glance"]}], "requirements": [{"id": "R1", "text": "Define services with durations", "priority": "must", "persona": "owner"}, {"id": "R2", "text": "Customers book only free slots", "priority": "must", "persona": "receptionist"}, {"id": "R3", "text": "Remind customers before their visit", "priority": "should", "persona": "owner"}], "assumptions": ["Single branch, one timezone"], "model": {"enums": [{"id": "appt_status", "values": [{"value": "requested", "label": "Requested", "color": "slate"}, {"value": "confirmed", "label": "Confirmed", "color": "green"}, {"value": "done", "label": "Done", "color": "blue"}, {"value": "cancelled", "label": "Cancelled", "color": "red"}]}], "entities": [{"id": "service", "label": "Service", "plural": "Services", "icon": "scissors", "fields": [{"id": "name", "type": "text", "required": true, "unique": true}, {"id": "duration_min", "type": "int", "required": true}, {"id": "price", "type": "money", "required": true}], "display": {"title": "{name}", "subtitle": "{price}"}}, {"id": "slot", "label": "Slot", "plural": "Slots", "icon": "clock", "fields": [{"id": "service", "type": "ref", "target": "service", "required": true, "onDelete": "cascade", "relation_name": "slots"}, {"id": "start_time", "type": "datetime", "required": true, "index": true}, {"id": "available", "type": "bool", "default": true}], "display": {"title": "{start_time}", "subtitle": "{service.name}"}}, {"id": "appointment", "label": "Appointment", "plural": "Appointments", "icon": "calendar", "fields": [{"id": "slot", "type": "ref", "target": "slot", "required": true, "onDelete": "restrict"}, {"id": "customer_name", "type": "text", "required": true}, {"id": "customer_phone", "type": "phone"}, {"id": "status", "type": "enum", "enum": "appt_status", "default": "requested", "index": true}, {"id": "reminded", "type": "bool", "default": false}], "display": {"title": "{customer_name}", "subtitle": "{slot.start_time}"}}]}, "access": {"roles": [{"id": "owner", "label": "Owner"}, {"id": "receptionist", "label": "Receptionist"}], "rules": [{"entity": "*", "role": "owner", "ops": ["read", "create", "update", "delete"]}, {"entity": "appointment", "role": "receptionist", "ops": ["read", "create", "update"]}, {"entity": "slot", "role": "receptionist", "ops": ["read"]}, {"entity": "service", "role": "receptionist", "ops": ["read"]}]}, "ui": {"theme": {"archetype": "calendar-first", "palette": "rose", "density": "comfortable", "radius": "md", "fonts": "inter"}, "nav": [{"page": "today", "label": "Today", "icon": "calendar"}, {"page": "appointments", "label": "Bookings", "icon": "list"}, {"page": "services", "label": "Services", "icon": "scissors", "roles": ["owner"]}], "pages": [{"id": "today", "route": "/", "title": "Today", "roles": ["owner", "receptionist"], "layout": "layout.sidebar", "blocks": [{"id": "b_free", "type": "metric.stat", "props": {"entity": "slot", "items": [{"label": "Free slots", "agg": "count", "where": "available == true"}]}}, {"id": "b_today", "type": "data.table", "props": {"entity": "appointment", "columns": ["customer_name", "slot.start_time", "status"], "create": true}}]}, {"id": "appointments", "route": "/bookings", "title": "Bookings", "roles": ["owner", "receptionist"], "layout": "layout.sidebar", "blocks": [{"id": "b_filter", "type": "filter.bar", "props": {"entity": "appointment", "fields": ["status"], "search": ["customer_name"]}}, {"id": "b_table", "type": "data.table", "props": {"entity": "appointment", "columns": ["customer_name", "status", "reminded"], "row_link": "booking_detail", "create": true}}]}, {"id": "booking_detail", "route": "/bookings/:id", "title": "Booking", "roles": ["owner", "receptionist"], "layout": "layout.sidebar", "blocks": [{"id": "b_detail", "type": "record.detail", "props": {"entity": "appointment", "sections": [{"title": "Visit", "fields": ["slot", "customer_name", "customer_phone", "status"]}]}}]}, {"id": "services", "route": "/services", "title": "Services", "roles": ["owner"], "layout": "layout.sidebar", "blocks": [{"id": "b_slots", "type": "data.table", "props": {"entity": "slot", "columns": ["service", "start_time", "available"], "create": true}}, {"id": "b_svc", "type": "data.table", "props": {"entity": "service", "columns": ["name", "duration_min", "price"], "create": true}}]}]}, "automations": [{"id": "remind", "trigger": {"type": "schedule", "schedule": "daily 09:00"}, "steps": [{"action": "send_email", "when": "reminded == false", "params": {"to": "customer_phone", "subject": "Reminder"}}]}], "seed": {"service": [{"_key": "s1", "name": "Haircut", "duration_min": 30, "price": 25}, {"_key": "s2", "name": "Color", "duration_min": 90, "price": 80}], "slot": [{"_key": "t1", "service": "@s1", "start_time": "2026-05-01T10:00:00", "available": true}], "appointment": [{"slot": "@t1", "customer_name": "Maya", "status": "requested", "reminded": false}]}, "integrations": [], "trace": [{"requirement": "R1", "satisfied_by": ["entity:service", "page:services"]}, {"requirement": "R2", "satisfied_by": ["entity:slot", "entity:appointment", "page:today"]}, {"requirement": "R3", "satisfied_by": ["automation:remind"]}]}