{"spec_version": "1.0", "app": {"name": "PipeDrive Lite", "tagline": "Leads in, revenue out", "domain": "crm", "locale": "en", "currency": "USD", "timezone": "UTC"}, "personas": [{"id": "owner", "name": "Founder", "goals": ["see pipeline value", "nothing slips"]}, {"id": "sales", "name": "Sales rep", "goals": ["work my leads", "log every touch"]}], "requirements": [{"id": "R1", "text": "Move leads across stages on a board", "priority": "must", "persona": "sales"}, {"id": "R2", "text": "Log activities per lead", "priority": "must", "persona": "sales"}, {"id": "R3", "text": "Total open pipeline value", "priority": "should", "persona": "owner"}], "assumptions": ["Single team, no territories"], "model": {"enums": [{"id": "lead_stage", "values": [{"value": "new", "label": "New", "color": "slate"}, {"value": "contacted", "label": "Contacted", "color": "amber"}, {"value": "qualified", "label": "Qualified", "color": "blue"}, {"value": "won", "label": "Won", "color": "green"}, {"value": "lost", "label": "Lost", "color": "red"}]}], "entities": [{"id": "lead", "label": "Lead", "plural": "Leads", "icon": "user", "fields": [{"id": "name", "type": "text", "required": true}, {"id": "email", "type": "email"}, {"id": "stage", "type": "enum", "enum": "lead_stage", "default": "new", "index": true}, {"id": "value", "type": "money", "default": 0}, {"id": "owner", "type": "text", "index": true}], "display": {"title": "{name}", "subtitle": "{email}"}}, {"id": "activity", "label": "Activity", "plural": "Activities", "icon": "note", "fields": [{"id": "lead", "type": "ref", "target": "lead", "required": true, "onDelete": "cascade", "relation_name": "activities"}, {"id": "note", "type": "longtext", "required": true}, {"id": "done", "type": "bool", "default": false}], "display": {"title": "{note}"}}]}, "access": {"roles": [{"id": "owner", "label": "Owner"}, {"id": "sales", "label": "Sales"}], "rules": [{"entity": "*", "role": "owner", "ops": ["read", "create", "update", "delete"]}, {"entity": "lead", "role": "sales", "ops": ["read", "create", "update"]}, {"entity": "activity", "role": "sales", "ops": ["read", "create", "update", "delete"]}]}, "ui": {"theme": {"archetype": "pipeline-board", "palette": "indigo", "density": "comfortable", "radius": "md", "fonts": "inter"}, "nav": [{"page": "pipeline", "label": "Pipeline", "icon": "columns"}, {"page": "leads", "label": "Leads", "icon": "list"}, {"page": "activities", "label": "Activities", "icon": "note"}], "pages": [{"id": "pipeline", "route": "/", "title": "Pipeline", "roles": ["owner", "sales"], "layout": "layout.sidebar", "blocks": [{"id": "b_value", "type": "metric.stat", "props": {"entity": "lead", "items": [{"label": "Open value", "agg": "sum", "field": "value", "where": "stage != 'won'"}]}}, {"id": "b_board", "type": "data.kanban", "props": {"entity": "lead", "group_by": "stage", "card": {"title": "name", "subtitle": "email", "badges": ["owner"]}, "drag_transitions": false}}]}, {"id": "leads", "route": "/leads", "title": "Leads", "roles": ["owner", "sales"], "layout": "layout.sidebar", "blocks": [{"id": "b_filter", "type": "filter.bar", "props": {"entity": "lead", "fields": ["stage", "owner"], "search": ["name", "email"]}}, {"id": "b_table", "type": "data.table", "props": {"entity": "lead", "columns": ["name", "stage", "value", "owner"], "create": true}}]}, {"id": "activities", "route": "/activities", "title": "Activities", "roles": ["owner", "sales"], "layout": "layout.sidebar", "blocks": [{"id": "b_act", "type": "data.table", "props": {"entity": "activity", "columns": ["lead", "note", "done"], "create": true}}]}]}, "automations": [{"id": "welcome", "trigger": {"type": "record.created", "entity": "lead"}, "steps": [{"action": "notify", "params": {"role": "sales", "message": "New lead"}}]}], "seed": {"lead": [{"_key": "d1", "name": "Acme Co", "email": "buy@acme.co", "stage": "new", "value": 5000, "owner": "Jo"}, {"_key": "d2", "name": "Beta LLC", "stage": "contacted", "value": 2000, "owner": "Jo"}], "activity": [{"lead": "@d1", "note": "Intro call", "done": true}]}, "integrations": [], "trace": [{"requirement": "R1", "satisfied_by": ["entity:lead", "page:pipeline"]}, {"requirement": "R2", "satisfied_by": ["entity:activity", "page:activities"]}, {"requirement": "R3", "satisfied_by": ["page:pipeline"]}]}