{"spec_version": "1.0", "app": {"name": "Stockroom", "tagline": "Small-shop inventory without the spreadsheet", "domain": "retail_inventory", "locale": "en", "currency": "USD", "timezone": "UTC"}, "personas": [{"id": "owner", "name": "Shop owner", "goals": ["never run out of best sellers", "know stock value"]}, {"id": "staff", "name": "Floor staff", "goals": ["find where an item lives", "log restocks"]}], "requirements": [{"id": "R1", "text": "Track items with SKU, quantity and storage location", "priority": "must", "persona": "owner"}, {"id": "R2", "text": "See low-stock items at a glance", "priority": "must", "persona": "staff"}, {"id": "R3", "text": "Know total stock value per item and overall", "priority": "should", "persona": "owner"}], "assumptions": ["Single store, no barcode hardware"], "model": {"enums": [], "entities": [{"id": "location", "label": "Location", "plural": "Locations", "icon": "pin", "fields": [{"id": "name", "type": "text", "required": true, "unique": true}, {"id": "aisle", "type": "text"}], "display": {"title": "{name}", "subtitle": "{aisle}"}}, {"id": "item", "label": "Item", "plural": "Items", "icon": "box", "fields": [{"id": "sku", "type": "text", "required": true, "unique": true, "index": true}, {"id": "name", "type": "text", "required": true}, {"id": "qty", "type": "int", "required": true, "default": 0}, {"id": "reorder_at", "type": "int", "default": 5}, {"id": "price", "type": "money", "required": true}, {"id": "stock_value", "type": "money", "computed": {"formula": "qty * price"}}, {"id": "location", "type": "ref", "target": "location", "onDelete": "restrict"}], "display": {"title": "{name}", "subtitle": "{sku}"}}]}, "access": {"roles": [{"id": "owner", "label": "Owner"}, {"id": "staff", "label": "Staff"}], "rules": [{"entity": "*", "role": "owner", "ops": ["read", "create", "update", "delete"]}, {"entity": "item", "role": "staff", "ops": ["read", "update"]}, {"entity": "location", "role": "staff", "ops": ["read"]}]}, "ui": {"theme": {"archetype": "table-first", "palette": "slate", "density": "comfortable", "radius": "md", "fonts": "inter"}, "nav": [{"page": "dashboard", "label": "Dashboard", "icon": "home"}, {"page": "items", "label": "Items", "icon": "list"}, {"page": "locations", "label": "Locations", "icon": "pin", "roles": ["owner"]}], "pages": [{"id": "dashboard", "route": "/", "title": "Dashboard", "roles": ["owner", "staff"], "layout": "layout.sidebar", "blocks": [{"id": "b_low", "type": "metric.stat", "props": {"entity": "item", "items": [{"label": "Low stock", "agg": "count", "where": "qty < reorder_at"}]}}, {"id": "b_items", "type": "data.table", "props": {"entity": "item", "columns": ["sku", "name", "qty", "stock_value"], "create": true}}]}, {"id": "items", "route": "/items", "title": "Items", "roles": ["owner", "staff"], "layout": "layout.sidebar", "blocks": [{"id": "b_filter", "type": "filter.bar", "props": {"entity": "item", "fields": ["location"], "search": ["name", "sku"]}}, {"id": "b_table", "type": "data.table", "props": {"entity": "item", "columns": ["sku", "name", "qty", "price", "location"], "create": true}}]}, {"id": "locations", "route": "/locations", "title": "Locations", "roles": ["owner"], "layout": "layout.sidebar", "blocks": [{"id": "b_loc", "type": "data.table", "props": {"entity": "location", "columns": ["name", "aisle"], "create": true}}]}]}, "automations": [{"id": "flag_low", "trigger": {"type": "record.updated", "entity": "item"}, "steps": [{"action": "notify", "when": "qty < reorder_at", "params": {"role": "owner", "message": "Low stock"}}]}], "seed": {"location": [{"_key": "l1", "name": "Back room", "aisle": "B"}, {"_key": "l2", "name": "Front shelf", "aisle": "A"}], "item": [{"_key": "i1", "sku": "MUG-001", "name": "Clay mug", "qty": 24, "reorder_at": 10, "price": 12, "location": "@l2"}, {"_key": "i2", "sku": "PLT-009", "name": "Dinner plate", "qty": 3, "reorder_at": 10, "price": 18, "location": "@l1"}]}, "integrations": [], "trace": [{"requirement": "R1", "satisfied_by": ["entity:item", "page:items"]}, {"requirement": "R2", "satisfied_by": ["page:dashboard"]}, {"requirement": "R3", "satisfied_by": ["entity:item"]}]}