{"spec_version": "1.0", "app": {"name": "T"}, "model": {"enums": [{"id": "st", "values": [{"value": "a", "label": "A"}, {"value": "b", "label": "B"}]}], "entities": [{"id": "widget", "label": "Widget", "fields": [{"id": "name", "type": "text"}, {"id": "status", "type": "enum", "enum": "st", "default": "a"}], "display": {"title": "{name}"}, "lifecycle": {"field": "status", "initial": "a", "transitions": [{"id": "go", "from": "a", "to": "b", "label": "Go", "roles": ["owner"]}, {"id": "back", "from": "b", "to": "a", "label": "Back", "roles": ["owner"]}]}}, {"id": "part", "label": "Part", "fields": [{"id": "widget", "type": "ref", "target": "widget", "relation_name": "parts"}, {"id": "cost", "type": "money", "computed": {"formula": "1 + 1"}}]}]}, "access": {"roles": [{"id": "owner"}], "rules": [{"entity": "*", "role": "owner", "ops": ["read"]}]}, "ui": {"nav": [{"page": "home", "label": "Home"}], "pages": [{"id": "home", "route": "/", "title": "Home", "roles": ["owner"], "blocks": [{"id": "b1", "type": "data.table", "props": {"entity": "widget"}}, {"id": "b2", "type": "data.table", "props": {"entity": "part"}}]}]}, "automations": [], "seed": {}, "integrations": [], "trace": []}